{
  "id": "pencil",
  "name": "Pencil",
  "version": "0.5.0",
  "maturity": "first-release-profile-candidate-local-runtime",
  "category": "forms",
  "spine": {
    "id": "forms",
    "record": "form response"
  },
  "replaces": [
    { "name": "Typeform", "edition": null },
    { "name": "Google Forms", "edition": null },
    { "name": "Jotform", "edition": null }
  ],
  "description": "Collect feedback, understand responses, and turn insights into assigned actions.",
  "scope": "One business, one shared workspace, equal operators with no roles.",
  "capabilities": [
    {
      "id": "landing",
      "description": "The owner-configured public landing at `/`, matching the canonical published flow's respondent experience and admission state.",
      "clauses": [
        "HOME-001"
      ]
    },
    {
      "id": "product-site",
      "description": "Pencil's own product page at `/` by default (`/pencil` redirects there) and documentation at `/docs`: sessionless, cookieless and same-origin. An explicit respondent landing selection overrides the default root.",
      "clauses": [
        "SITE-001",
        "SITE-002",
        "DOCS-001"
      ]
    },
    {
      "id": "application-shell",
      "description": "A session-gated operator shell at `/app` with labelled, keyboard-operable navigation; `/signin` is the only sessionless entry point.",
      "clauses": [
        "SHELL-001"
      ]
    },
    {
      "id": "operators",
      "description": "Equal operators with no roles, invited and removed in settings, whose sign-in depends on mail.",
      "clauses": [
        "OPER-001",
        "OPER-002",
        "OPER-003"
      ]
    },
    {
      "id": "workspace",
      "description": "One workspace time zone and sending-hours window, plus the guarantee that optional AI and task adapters are configuration, not degradation.",
      "clauses": [
        "WS-001",
        "WS-002",
        "WS-003"
      ]
    },
    {
      "id": "dashboard",
      "description": "An onboarding empty state and a sortable flow list with completion and audience figures.",
      "clauses": [
        "DASH-001",
        "DASH-002"
      ]
    },
    {
      "id": "flow-builder",
      "description": "Building, branching, validating, publishing, and revising adaptive flows with stable structure IDs.",
      "clauses": [
        "FLOW-001",
        "FLOW-002",
        "FLOW-003",
        "FLOW-004",
        "FLOW-005",
        "FLOW-006",
        "FLOW-007",
        "FLOW-008",
        "FLOW-009",
        "FLOW-010",
        "FLOW-011",
        "FLOW-012",
        "FLOW-013",
        "FLOW-014",
        "FLOW-015",
        "FLOW-016",
        "FLOW-017",
        "FLOW-018",
        "FLOW-019",
        "FLOW-020",
        "FLOW-021"
      ]
    },
    {
      "id": "audiences",
      "description": "Contacts, segments, and participants for inviting a known audience with consent and send-time eligibility checks.",
      "clauses": [
        "AUD-001",
        "AUD-002",
        "AUD-003",
        "AUD-004",
        "AUD-005",
        "AUD-006"
      ]
    },
    {
      "id": "distribution",
      "description": "Public links, embeds, invitations, reminders, opt-out, and durable mail delivery with retry and adapter isolation.",
      "clauses": [
        "DIST-001",
        "DIST-002",
        "DIST-003",
        "DIST-004",
        "DIST-005",
        "DIST-006",
        "DIST-007",
        "DIST-008",
        "DIST-009",
        "DIST-010"
      ]
    },
    {
      "id": "respondent-experience",
      "description": "The one-question-at-a-time public flow: answers, back navigation, privacy disclosure, abuse defences, and quarantine review.",
      "clauses": [
        "RESP-001",
        "RESP-002",
        "RESP-003",
        "RESP-004",
        "RESP-005",
        "RESP-006",
        "RESP-007",
        "RESP-008",
        "RESP-009",
        "RESP-010",
        "RESP-011",
        "RESP-012",
        "RESP-013",
        "RESP-014",
        "RESP-015",
        "RESP-016",
        "RESP-017",
        "RESP-018",
        "RESP-019"
      ]
    },
    {
      "id": "response-ledger",
      "description": "A response ledger with filters, counts, and lossless CSV/JSON export.",
      "clauses": [
        "LEDG-001",
        "LEDG-002",
        "LEDG-003",
        "LEDG-004"
      ]
    },
    {
      "id": "results",
      "description": "AI-free response summary, drop-off, stated denominators, device split, and cross-revision results.",
      "clauses": [
        "RSLT-001",
        "RSLT-002",
        "RSLT-003",
        "RSLT-004",
        "RSLT-005"
      ]
    },
    {
      "id": "analysis",
      "description": "Budgeted, evidence-linked AI analysis with disclosure thresholds, provenance, output validation, and visible failure.",
      "clauses": [
        "ANLY-001",
        "ANLY-002",
        "ANLY-003",
        "ANLY-004",
        "ANLY-005",
        "ANLY-006",
        "ANLY-007",
        "ANLY-008",
        "ANLY-009",
        "ANLY-010",
        "ANLY-011",
        "ANLY-012",
        "ANLY-013",
        "ANLY-014",
        "ANLY-015",
        "ANLY-016"
      ]
    },
    {
      "id": "actions",
      "description": "Turning a recommendation, written by an operator or later by an analysis, into an owned, measurable action with idempotent, confirmed external task delivery.",
      "clauses": [
        "ACT-001",
        "ACT-002",
        "ACT-003",
        "ACT-004",
        "ACT-005",
        "ACT-006",
        "ACT-007",
        "ACT-008"
      ]
    },
    {
      "id": "notifications",
      "description": "Per-flow Immediately, Daily or Off response mail with durable delivery state and no mail loops, and in-app analysis notifications.",
      "clauses": [
        "NOTIFY-001",
        "NOTIFY-002",
        "NOTIFY-003",
        "NOTIFY-004"
      ]
    },
    {
      "id": "data-ownership",
      "description": "Complete export and bounded response erasure across every dependent record.",
      "clauses": [
        "DATA-001",
        "DATA-002"
      ]
    },
    {
      "id": "business-brand",
      "description": "Saved business name, supporting line, accessible accent, own-origin logo and public landing selection across respondent surfaces.",
      "clauses": [
        "BRAND-001"
      ]
    },
    {
      "id": "form-import",
      "description": "Reviewed form-definition and historical response imports with explicit losses, resumable inert commits and guarded undo.",
      "clauses": [
        "IMPORT-001",
        "IMPORT-002",
        "IMPORT-003",
        "IMPORT-004"
      ]
    }
  ],
  "nonGoals": [
    "Multiple workspaces",
    "Roles and permissions",
    "Agency management",
    "Payments and order forms",
    "Appointment scheduling",
    "Public template marketplace",
    "Survey-panel recruitment",
    "Native mobile apps",
    "Video, audio, signature, and file-upload questions",
    "Single sign-on",
    "Advanced fraud scoring",
    "Broad marketing analytics",
    "Live collaborative editing",
    "Arbitrary automation builder",
    "Storing or reporting the answers of an abandoned session"
  ],
  "externals": [
    {
      "id": "mail",
      "required": true,
      "why": "Cloudflare has no owned primitive that delivers transactional email to external recipients, and BASE-ACCESS-001 magic-link sign-in is delivered by mail, so no deployment can run without it.",
      "data": [
        "operator email and magic-link sign-in token",
        "participant email and display name",
        "business and flow name",
        "opaque invitation or opt-out link",
        "invitation, reminder, notification, or digest copy"
      ],
      "adapters": [
        "mail.sender.v1"
      ]
    },
    {
      "id": "ai",
      "required": false,
      "why": "Evidence synthesis and draft-question assistance require a model provider; no model is bundled with the deployment.",
      "data": [
        "draft question text for requested assistance",
        "published revision prompts and settings",
        "completed answer text and structured values selected for an analysis",
        "stable response IDs without contact identity"
      ],
      "adapters": [
        "ai.provider.v1"
      ]
    },
    {
      "id": "task-destination",
      "required": false,
      "why": "Creating a task in a buyer-selected task system necessarily sends the confirmed action to that system.",
      "data": [
        "operator-confirmed action fields",
        "operator-confirmed report link"
      ],
      "adapters": [
        "task.destination.v1"
      ]
    },
    {
      "id": "typeform",
      "required": false,
      "why": "Fetching a form definition at the owner’s request needs Typeform’s forms.read API. The personal token is used for this request only and is never stored.",
      "data": [
        "Typeform form identifier",
        "owner-entered Typeform personal access token (Bearer authorization only)"
      ],
      "adapters": [
        "typeform.forms.read.v1"
      ]
    }
  ],
  "env": [
    {
      "name": "APP_ORIGIN",
      "required": true,
      "secret": false,
      "why": "Canonical HTTPS origin for auth, reports, and public flow links."
    },
    {
      "name": "SEED_ADMIN_EMAIL",
      "required": true,
      "secret": false,
      "why": "Allow-listed operator created during setup."
    },
    {
      "name": "MAIL_PROVIDER",
      "required": true,
      "secret": false,
      "why": "Selects the mail sender adapter. Required: magic-link sign-in depends on it (OPER-003)."
    },
    {
      "name": "MAIL_RELAY_URL",
      "required": false,
      "secret": false,
      "why": "Required when MAIL_PROVIDER is rer. Run Edit Run supplies its Managed mail relay URL."
    },
    {
      "name": "MAIL_API_KEY",
      "required": false,
      "secret": true,